{
  "profile": "ZTWC01 proposed candidate",
  "scope": {
    "kind": 1,
    "account_id": "00000000-0000-0000-0000-000000000001",
    "device_id": "00000000-0000-0000-0000-000000000002",
    "line_id": "00000000-0000-0000-0000-000000000003",
    "interval_id": "00000000-0000-0000-0000-000000000004",
    "context_id": "00000000-0000-0000-0000-000000000005",
    "binding_generation": 1,
    "revision": 1,
    "expires_ms": 1893500000000,
    "trust_generation": 1,
    "manifest_version": 1,
    "peer_digest": "544f3f867456df14a9e62879ec6fb221b98d8ef30b5baf81a6bddefba1a5148c",
    "reader_id": "0202020202020202020202020202020202020202020202020202020202020202",
    "manifest_digest": "0303030303030303030303030303030303030303030303030303030303030303"
  },
  "aad_hex": "5a5457430101000000000000000000000000000000010000000000000000000000000000000200000000000000000000000000000003000000000000000000000000000000040000000000000000000000000000000500000000000000010000000000000001000001b8dd65170000000000000000010000000000000001544f3f867456df14a9e62879ec6fb221b98d8ef30b5baf81a6bddefba1a5148c02020202020202020202020202020202020202020202020202020202020202020303030303030303030303030303030303030303030303030303030303030303",
  "hpke_info_hex": "5a542f776f726b666c6f772d636f6e746578742f68706b652f7631005a5457430101000000000000000000000000000000010000000000000000000000000000000200000000000000000000000000000003000000000000000000000000000000040000000000000000000000000000000500000000000000010000000000000001000001b8dd65170000000000000000010000000000000001544f3f867456df14a9e62879ec6fb221b98d8ef30b5baf81a6bddefba1a5148c02020202020202020202020202020202020202020202020202020202020202020303030303030303030303030303030303030303030303030303030303030303"
}
